Ether / IP / TCP 13.107.246.48:https > 192.168.0.110:52168 A
Ether / IP / TCP 192.168.0.110:52168 > 13.107.246.48:https A
Ether / IP / TCP 192.168.0.110:52209 > 20.189.172.33:https RA
Ether / IP / TCP 140.82.112.22:https > 192.168.0.110:52208 A
Ether / IP / TCP 192.168.0.110:52208 > 140.82.112.22:https A
Ether / IP / TCP 192.168.0.110:52215 > 192.168.0.101:ms_do S
Ether / IP / TCP 192.168.0.101:ms_do > 192.168.0.110:52215 SA
Ether / IP / TCP 192.168.0.110:52215 > 192.168.0.101:ms_do A
Ether / IP / TCP 192.168.0.110:52215 > 192.168.0.101:ms_do PA / Raw
Ether / IP / TCP 192.168.0.101:ms_do > 192.168.0.110:52215 PA / Raw
