Ether / IP / TCP 140.82.113.22:https > 192.168.0.106:64437 PA / Raw
Ether / IP / TCP 140.82.113.22:https > 192.168.0.106:64437 PA / Raw
Ether / IP / TCP 140.82.113.22:https > 192.168.0.106:64437 FA
Ether / IP / TCP 192.168.0.106:64437 > 140.82.113.22:https A
Ether / IP / TCP 192.168.0.106:64437 > 140.82.113.22:https PA / Raw
Ether / IP / TCP 192.168.0.106:64437 > 140.82.113.22:https FA
Ether / IP / TCP 192.168.0.106:64437 > 140.82.113.22:https FPA / Raw
Ether / IP / TCP 192.168.0.106:64439 > 140.82.113.22:https S
Ether / IP / TCP 140.82.113.22:https > 192.168.0.106:64439 SA
Ether / IP / TCP 192.168.0.106:64439 > 140.82.113.22:https A
