Ether / ARP who has 169.254.169.254 says 192.168.0.110
Ether / IP / TCP 192.168.0.110:52187 > 192.168.0.101:ms_do S
Ether / IP / TCP 192.168.0.101:ms_do > 192.168.0.110:52187 SA
Ether / IP / TCP 192.168.0.110:52187 > 192.168.0.101:ms_do A
Ether / IP / TCP 192.168.0.110:52187 > 192.168.0.101:ms_do PA / Raw
Ether / IP / TCP 192.168.0.101:ms_do > 192.168.0.110:52187 PA / Raw
Ether / IP / TCP 192.168.0.110:52187 > 192.168.0.101:ms_do PA / Raw
Ether / IP / TCP 192.168.0.101:ms_do > 192.168.0.110:52187 PA / Raw
Ether / IP / TCP 192.168.0.101:ms_do > 192.168.0.110:52187 FA
Ether / IP / TCP 192.168.0.110:52187 > 192.168.0.101:ms_do A
