Ether / IP / TCP 140.82.113.22:https > 192.168.0.110:52235 A
Ether / IP / TCP 192.168.0.110:52235 > 140.82.113.22:https A
Ether / IP / TCP 192.168.0.110:49415 > 4.213.25.242:https PA / Raw
Ether / IP / TCP 4.213.25.242:https > 192.168.0.110:49415 PA / Raw
Ether / IP / TCP 192.168.0.110:49415 > 4.213.25.242:https A
Ether / IP / TCP 192.168.0.110:52251 > 69.192.1.155:https S
Ether / IP / TCP 69.192.1.155:https > 192.168.0.110:52251 SA
Ether / IP / TCP 192.168.0.110:52251 > 69.192.1.155:https A
Ether / IP / TCP 192.168.0.110:52251 > 69.192.1.155:https PA / Raw
Ether / IP / TCP 69.192.1.155:https > 192.168.0.110:52251 PA / Raw
